{
  "schemaVersion": 1,
  "locale": "ca",
  "verifiedAt": "2026-07-24",
  "reviewPolicy": {
    "sourceReview": "completed",
    "sourceReviewer": "Codex implementation review",
    "subjectMatterSignoff": "pending ENTI-UB subject reviewer",
    "languageSignoff": "pending ENTI-UB Catalan reviewer"
  },
  "practice": {
    "id": "practice-upload-limit",
    "domain": "practica",
    "tag": "Pràctica",
    "context": "Regla d'aquest exemple: el campus només accepta fitxers de 10 MB o menys.",
    "claims": [
      "Un fitxer de 8 MB compleix el límit.",
      "Un fitxer de 12 MB també compleix el límit.",
      "El límit inclou els fitxers que ocupen exactament 10 MB."
    ],
    "errorIndex": 1,
    "explanation": "La segona frase contradiu la regla: 12 MB supera el límit de 10 MB.",
    "verificationAction": "Aquí n'hi havia prou de comparar cada xifra amb la regla visible.",
    "source": {
      "type": "activity-defined",
      "publisher": "ENTI-UB",
      "title": "Regla definida dins de l'activitat",
      "url": "",
      "checkedAt": "2026-07-24"
    },
    "provenance": "Exemple sintètic escrit per ensenyar el control de resposta.",
    "review": {
      "factual": "source-checked",
      "language": "pending-human-signoff"
    }
  },
  "domains": [
    {
      "id": "videojocs",
      "label": "Desenvolupament de videojocs",
      "shortLabel": "Videojocs",
      "description": "Rendiment, temps i matemàtiques habituals en motors de joc.",
      "items": [
        {
          "id": "games-fixed-update",
          "difficulty": "transfer",
          "context": "En un motor amb pas de física fix, el renderitzat i la simulació no han d'avançar necessàriament al mateix ritme.",
          "claims": [
            "FixedUpdate s'executa exactament una vegada per cada fotograma renderitzat.",
            "Un pas fix de 0,02 segons equival a 50 actualitzacions de física per segon de joc.",
            "Un fotograma pot contenir zero, una o diverses actualitzacions de física segons el temps acumulat."
          ],
          "errorIndex": 0,
          "explanation": "La primera frase és falsa. Les actualitzacions de física segueixen el pas fix, no una relació obligatòria d'una per fotograma.",
          "verificationAction": "Consulta la documentació del bucle temporal del motor i diferencia renderitzat de simulació.",
          "source": {
            "type": "authoritative",
            "publisher": "Unity Technologies",
            "title": "Time and frame rate management",
            "url": "https://docs.unity3d.com/2023.2/Documentation/Manual/TimeFrameManagement.html",
            "checkedAt": "2026-07-24"
          },
          "provenance": "Resposta sintètica basada en documentació oficial de Unity.",
          "review": {
            "factual": "source-checked",
            "language": "pending-human-signoff"
          }
        },
        {
          "id": "games-delta-time",
          "difficulty": "introductory",
          "context": "Unity crida Update una vegada per fotograma i exposa el temps transcorregut des de l'últim fotograma.",
          "claims": [
            "Time.deltaTime expressa en segons el temps transcorregut des del fotograma anterior.",
            "Moure un objecte una distància fixa a cada Update garanteix una velocitat constant encara que canviïn els FPS.",
            "Multiplicar una velocitat per Time.deltaTime ajuda a fer el moviment independent de la taxa de fotogrames."
          ],
          "errorIndex": 1,
          "explanation": "La segona frase és falsa. Una distància fixa per fotograma fa que la velocitat canviï quan canvien els FPS.",
          "verificationAction": "Comprova les unitats: metres per segon × segons per fotograma = metres per fotograma.",
          "source": {
            "type": "authoritative",
            "publisher": "Unity Technologies",
            "title": "Time and frame rate management",
            "url": "https://docs.unity3d.com/2023.2/Documentation/Manual/TimeFrameManagement.html",
            "checkedAt": "2026-07-24"
          },
          "provenance": "Resposta sintètica basada en documentació oficial de Unity.",
          "review": {
            "factual": "source-checked",
            "language": "pending-human-signoff"
          }
        },
        {
          "id": "games-frame-budget",
          "difficulty": "introductory",
          "context": "El pressupost teòric d'un fotograma es calcula dividint 1.000 mil·lisegons pels FPS objectiu.",
          "claims": [
            "A 30 FPS, cada fotograma disposa d'uns 33,33 ms.",
            "A 60 FPS, cada fotograma disposa d'uns 16,67 ms.",
            "A 120 FPS, cada fotograma disposa de 12 ms."
          ],
          "errorIndex": 2,
          "explanation": "La tercera frase és falsa: 1.000 ÷ 120 són aproximadament 8,33 ms, no 12 ms.",
          "verificationAction": "Aquest error es pot verificar directament amb el càlcul 1.000 ÷ FPS.",
          "source": {
            "type": "authoritative",
            "publisher": "Unity Technologies",
            "title": "Handling variation in time",
            "url": "https://docs.unity3d.com/6000.0/Documentation/Manual/time-handling-variations.html",
            "checkedAt": "2026-07-24"
          },
          "provenance": "Resposta sintètica; les xifres es deriven de la fórmula indicada.",
          "review": {
            "factual": "source-checked",
            "language": "pending-human-signoff"
          }
        },
        {
          "id": "games-vector-normalization",
          "difficulty": "transfer",
          "context": "Considera un vector diferent de zero i la seva versió normalitzada.",
          "claims": [
            "El vector normalitzat manté la direcció de l'original.",
            "La magnitud del vector normalitzat és 1.",
            "Multiplicar-lo per una velocitat escalar produeix un vector amb aquella magnitud."
          ],
          "errorIndex": null,
          "explanation": "Les tres frases són correctes per a un vector diferent de zero.",
          "verificationAction": "Revisa la definició matemàtica o la documentació de Vector3.normalized.",
          "source": {
            "type": "authoritative",
            "publisher": "Unity Technologies",
            "title": "Vector3.normalized",
            "url": "https://docs.unity3d.com/6000.0/Documentation/ScriptReference/Vector3-normalized.html",
            "checkedAt": "2026-07-24"
          },
          "provenance": "Resposta sintètica amb la condició de vector no nul explicitada.",
          "review": {
            "factual": "source-checked",
            "language": "pending-human-signoff"
          }
        },
        {
          "id": "games-collider-bounds",
          "difficulty": "transfer",
          "context": "Unity exposa Collider.bounds com el volum delimitador del col·lisionador en l'espai del món.",
          "claims": [
            "Collider.bounds descriu un volum delimitador en coordenades de món.",
            "El volum encapsula el col·lisionador encara que no n'ajusti exactament la forma.",
            "Un col·lisionador desactivat o un GameObject inactiu pot retornar un volum buit."
          ],
          "errorIndex": null,
          "explanation": "Les tres frases són coherents amb la definició de Collider.bounds.",
          "verificationAction": "Consulta la referència exacta de la propietat en lloc d'inferir-la pel nom.",
          "source": {
            "type": "authoritative",
            "publisher": "Unity Technologies",
            "title": "Collider.bounds",
            "url": "https://docs.unity3d.com/6000.0/Documentation/ScriptReference/Collider-bounds.html",
            "checkedAt": "2026-07-24"
          },
          "provenance": "Resposta sintètica basada en documentació oficial de Unity.",
          "review": {
            "factual": "source-checked",
            "language": "pending-human-signoff"
          }
        }
      ]
    },
    {
      "id": "musica",
      "label": "Música",
      "shortLabel": "Música",
      "description": "Mètrica, intervals, freqüència i història musical.",
      "items": [
        {
          "id": "music-time-signature",
          "difficulty": "transfer",
          "context": "En la mètrica simple occidental, les dues xifres del compàs descriuen aspectes diferents.",
          "claims": [
            "En una indicació 3/4, la xifra inferior indica que hi ha tres pulsacions a cada compàs.",
            "En una indicació 3/4, una negra representa una pulsació de referència.",
            "En una indicació 3/4, la xifra superior 3 correspon a una mètrica triple simple."
          ],
          "errorIndex": 0,
          "explanation": "La primera frase és falsa. El nombre de pulsacions el dona la xifra superior; el 4 inferior identifica la negra com a valor de pulsació.",
          "verificationAction": "Separa sempre les funcions del numerador i del denominador.",
          "source": {
            "type": "authoritative",
            "publisher": "Open Music Theory",
            "title": "Meter and time signatures",
            "url": "https://openmusictheory.github.io/meter.html",
            "checkedAt": "2026-07-24"
          },
          "provenance": "Resposta sintètica basada en un manual obert de teoria musical.",
          "review": {
            "factual": "source-checked",
            "language": "pending-human-signoff"
          }
        },
        {
          "id": "music-octave-frequency",
          "difficulty": "introductory",
          "context": "En afinació de referència, A4 (la4) té una freqüència de 440 Hz i una octava duplica la freqüència.",
          "claims": [
            "Si A4 s'afina a 440 Hz, A5 és una octava per sobre i conserva la mateixa classe de nota.",
            "Si A4 s'afina a 440 Hz, la freqüència d'A5 és 660 Hz segons la relació entre octaves.",